{
  "check": "runtime_refinement",
  "status": "PASS",
  "formal_relation": "Runtime <= Spec",
  "counterexample": null,
  "evidence": [
    "trace origin: /home/user/creator-0/.creator-zero/experiment-7/pilot/trials/B/e7-p02/runtime-ledger.jsonl",
    "observable events matched: 10",
    "final reconstructed state: done={child-return,create-child,observe-evidence,propose-child,return-result,validate-child,verify-integration}|promoted=0|complete=1"
  ],
  "assumptions": [
    "Causal order is ledger position; timestamps are evidentiary metadata only.",
    "Only explicitly modeled governed events are checked; instrumentation completeness of the runtime is assumed, not proven."
  ],
  "unmapped_events": [],
  "detail": {
    "final_state": "done={child-return,create-child,observe-evidence,propose-child,return-result,validate-child,verify-integration}|promoted=0|complete=1",
    "matched_steps": 10
  }
}
